{
  "schemaVersion": 1,
  "id": "sqlite-operation-ledger-replay-v1",
  "status": "contract-frozen",
  "expect": {
    "caseCount": 96,
    "behaviorCaseCount": 48,
    "attackCaseCount": 48,
    "casesCanonicalUtf8Bytes": 81996,
    "casesSha256": "0e6b481368c774ac870b593bd8f86af1b97d0bdc6ab0df23c82f1d88d4a30f38"
  },
  "cases": [
    {
      "id": "OL-R01", "category": "behavior", "slug": "ts-all-request-vectors", "title": "TypeScript All Request Vectors",
      "objective": "TypeScript encodes all nine canonical mutation requests and matches every frozen fixture byte string and SHA-256 identity.",
      "minimumAssertions": ["All nine operation names appear once in canonical order.", "Every emitted request byte string and request hash equals the frozen vector."],
      "runtimeRequirements": ["typescript-native"],
      "expected": {"outcome": "accepted", "typedResult": "canonical-request-vector-set", "typedFailures": [], "requiresZeroUnintendedMutation": false, "requiresExactTransactionCleanup": false, "requiresLeakSentinelScan": true, "barrier": "none"}
    },
    {
      "id": "OL-R02", "category": "behavior", "slug": "python-all-request-vectors", "title": "Python All Request Vectors",
      "objective": "Python encodes all nine canonical mutation requests to byte-identical fixture vectors and SHA-256 identities.",
      "minimumAssertions": ["All nine Python request encodings are present in canonical order.", "Every Python byte string and hash exactly equals its TypeScript-independent frozen vector."],
      "runtimeRequirements": ["python-native"],
      "expected": {"outcome": "accepted", "typedResult": "canonical-request-vector-set", "typedFailures": [], "requiresZeroUnintendedMutation": false, "requiresExactTransactionCleanup": false, "requiresLeakSentinelScan": true, "barrier": "none"}
    },
    {
      "id": "OL-R03", "category": "behavior", "slug": "decode-encode-roundtrip", "title": "Decode Encode Round Trip",
      "objective": "Both runtimes decode and re-encode every canonical request without changing one byte or its identity hash.",
      "minimumAssertions": ["Each runtime accepts all nine closed request shapes.", "Decode followed by encode returns the exact original canonical bytes and hashes."],
      "runtimeRequirements": ["typescript-native", "python-native", "cross-language-exact"],
      "expected": {"outcome": "accepted", "typedResult": "canonical-request-roundtrip", "typedFailures": [], "requiresZeroUnintendedMutation": false, "requiresExactTransactionCleanup": false, "requiresLeakSentinelScan": true, "barrier": "none"}
    },
    {
      "id": "OL-R04", "category": "behavior", "slug": "legal-boundary-request-sizes", "title": "Legal Boundary Request Sizes",
      "objective": "Exact maximum identifiers, value carriers, and the 64-record append remain accepted within every declared bound.",
      "minimumAssertions": ["Every exact upper-bound carrier is accepted by both native codecs.", "The maximum append contains exactly 64 records and remains within canonical byte bounds."],
      "runtimeRequirements": ["typescript-native", "python-native", "cross-language-exact"],
      "expected": {"outcome": "accepted", "typedResult": "canonical-request-boundary-report", "typedFailures": [], "requiresZeroUnintendedMutation": false, "requiresExactTransactionCleanup": false, "requiresLeakSentinelScan": true, "barrier": "none"}
    },
    {
      "id": "OL-R05", "category": "behavior", "slug": "exact-retry-request-identity", "title": "Exact Retry Request Identity",
      "objective": "An exact operation retry after close and reopen matches stored request and result bytes without allocating a new sequence.",
      "minimumAssertions": ["The retried result is byte-identical to the first committed result.", "Ledger row count, maximum sequence, and singleton last sequence do not advance."],
      "runtimeRequirements": ["typescript-native", "python-native", "cross-language-exact", "destructive-database", "fresh-temporary-root", "explicit-database-path"],
      "expected": {"outcome": "accepted", "typedResult": "canonical-idempotent-result", "typedFailures": [], "requiresZeroUnintendedMutation": false, "requiresExactTransactionCleanup": false, "requiresLeakSentinelScan": true, "barrier": "none"}
    },
    {
      "id": "OL-R06", "category": "behavior", "slug": "captured-before-authorization", "title": "Captured Before Authorization",
      "objective": "Caller mutation before and after the authorization await cannot alter the detached canonical request stored by the provider.",
      "minimumAssertions": ["The provider captures a detached request before invoking authorization.", "Mutating every caller-owned carrier around the await leaves stored request bytes unchanged."],
      "runtimeRequirements": ["typescript-native", "python-native", "cross-language-exact", "destructive-database", "fresh-temporary-root", "explicit-database-path", "fault-injection"],
      "expected": {"outcome": "accepted", "typedResult": "canonical-capture-report", "typedFailures": [], "requiresZeroUnintendedMutation": false, "requiresExactTransactionCleanup": false, "requiresLeakSentinelScan": true, "barrier": "authorization-await"}
    },
    {
      "id": "OL-R07", "category": "attack", "slug": "invalid-request-utf8", "title": "Invalid Request UTF-8",
      "objective": "A malformed UTF-8 request BLOB is rejected as corruption without disclosing hostile payload bytes.",
      "minimumAssertions": ["Semantic audit rejects the first invalid UTF-8 byte sequence.", "Records, ledger, sequence singleton, and transaction state remain unchanged."],
      "runtimeRequirements": ["typescript-native", "python-native", "cross-language-exact", "destructive-database", "fresh-temporary-root", "explicit-database-path"],
      "expected": {"outcome": "rejected", "typedResult": null, "typedFailures": [{"name": "CycleStoreProviderError", "code": "GE_CYCLE_STORE_CORRUPTION", "operation": "inspect-schema", "retryable": false}], "requiresZeroUnintendedMutation": true, "requiresExactTransactionCleanup": true, "requiresLeakSentinelScan": true, "barrier": "none"}
    },
    {
      "id": "OL-R08", "category": "attack", "slug": "noncanonical-request-json", "title": "Noncanonical Request JSON",
      "objective": "Valid JSON with noncanonical key order, escaping, or insignificant syntax is rejected by exact byte round-trip validation.",
      "minimumAssertions": ["Decoded content equivalence cannot excuse byte-level noncanonical JSON.", "Audit rejects each order and escaping mutation without repairing the database."],
      "runtimeRequirements": ["typescript-native", "python-native", "cross-language-exact", "destructive-database", "fresh-temporary-root", "explicit-database-path"],
      "expected": {"outcome": "rejected", "typedResult": null, "typedFailures": [{"name": "CycleStoreProviderError", "code": "GE_CYCLE_STORE_CORRUPTION", "operation": "inspect-schema", "retryable": false}], "requiresZeroUnintendedMutation": true, "requiresExactTransactionCleanup": true, "requiresLeakSentinelScan": true, "barrier": "none"}
    },
    {
      "id": "OL-R09", "category": "attack", "slug": "request-shape-drift", "title": "Request Shape Drift",
      "objective": "Missing required fields and unknown fields are rejected under the closed operation-specific request codec.",
      "minimumAssertions": ["Every operation codec rejects a representative missing required field.", "Every operation codec rejects an unknown field and persists no normalized substitute."],
      "runtimeRequirements": ["typescript-native", "python-native", "cross-language-exact", "destructive-database", "fresh-temporary-root", "explicit-database-path"],
      "expected": {"outcome": "rejected", "typedResult": null, "typedFailures": [{"name": "CycleStoreProviderError", "code": "GE_CYCLE_STORE_CORRUPTION", "operation": "inspect-schema", "retryable": false}], "requiresZeroUnintendedMutation": true, "requiresExactTransactionCleanup": true, "requiresLeakSentinelScan": true, "barrier": "none"}
    },
    {
      "id": "OL-R10", "category": "attack", "slug": "request-number-domain", "title": "Request Number Domain",
      "objective": "Floats, unsafe integers, negative bounded values, and forbidden numeric carriers fail closed in both runtimes.",
      "minimumAssertions": ["Every forbidden numeric representative is rejected before replay.", "No runtime-specific coercion changes the typed failure or durable state."],
      "runtimeRequirements": ["typescript-native", "python-native", "cross-language-exact", "destructive-database", "fresh-temporary-root", "explicit-database-path"],
      "expected": {"outcome": "rejected", "typedResult": null, "typedFailures": [{"name": "CycleStoreProviderError", "code": "GE_CYCLE_STORE_CORRUPTION", "operation": "inspect-schema", "retryable": false}], "requiresZeroUnintendedMutation": true, "requiresExactTransactionCleanup": true, "requiresLeakSentinelScan": true, "barrier": "none"}
    },
    {
      "id": "OL-R11", "category": "attack", "slug": "request-size-depth-exhaustion", "title": "Request Size and Depth Exhaustion",
      "objective": "One-above byte, nesting-depth, and collection bounds fail before unbounded allocation or durable mutation.",
      "minimumAssertions": ["Byte and collection excesses return the exact quota failure.", "Forbidden nesting returns the exact invalid-argument failure under bounded parsing."],
      "runtimeRequirements": ["typescript-native", "python-native", "cross-language-exact", "destructive-database", "fresh-temporary-root", "explicit-database-path"],